,Sentence,sentiment,Sentiment Score,Subjectivity
4151,"“Damned English swine come here and insult Mike and try and spoil the fiesta.” “They’re so bloody,” Mike said.",-0.5106,-0.4,0.45
4152,"“I hate the English.” “They can’t insult Mike,” Bill said.",-0.7906,-0.4,0.45
4153,“Mike is a swell fellow.,0.0,0.0,0.0
4154,They can’t insult Mike.,-0.5106,0.0,0.0
4155,I won’t stand it.,0.0,0.0,0.0
4156,Who cares if he is a damn bankrupt?” His voice broke.,-0.3612,0.0,0.0
4157,“Who cares?” Mike said.,0.0,0.0,0.0
4158,“I don’t care.,0.4939,0.0,0.0
4159,Jake doesn’t care.,0.4939,0.0,0.0
4160,"Do _you_ care?” “No,” Edna said.",0.0,0.0,0.0
4161,“Are you a bankrupt?” “Of course I am.,0.0,0.0,0.0
4162,"You don’t care, do you, Bill?” Bill put his arm around Mike’s shoulder.",0.4939,0.0,0.0
4163,“I wish to hell I was a bankrupt.,-0.7579,0.0,0.0
4164,"I’d show those bastards.” “They’re just English,” Mike said.",0.0,0.0,0.0
4165,"“It never makes any difference what the English say.” “The dirty swine,” Bill said.",-0.4404,-0.3,0.4
4166,"“I’m going to clean them out.” “Bill,” Edna looked at me.",0.4019,0.3666666666666667,0.7000000000000001
4167,"“Please don’t go in again, Bill.",0.0,0.0,0.0
4168,"They’re so stupid.” “That’s it,” said Mike.",0.0,-0.7999999999999999,1.0
4169,“They’re stupid.,-0.5267,-0.7999999999999999,1.0
4170,"I knew that was what it was.” “They can’t say things like that about Mike,” Bill said.",0.3612,0.0,0.0
4171,“Do you know them?” I asked Mike.,0.0,0.0,0.0
4172,“No.,0.0,0.0,0.0
4173,I never saw them.,0.0,0.0,0.0
4174,"They say they know me.” “I won’t stand it,” Bill said.",0.0,0.0,0.0
4175,“Come on.,0.0,0.0,0.0
4176,"Let’s go over to the Suizo,” I said.",0.0,0.0,0.0
4177,"“They’re a bunch of Edna’s friends from Biarritz,” Bill said.",0.4767,0.0,0.0
4178,"“They’re simply stupid,” Edna said.",0.0,-0.7999999999999999,1.0
4179,"“One of them’s Charley Blackman, from Chicago,” Bill said.",0.0,0.0,0.0
4180,"“I was never in Chicago,” Mike said.",0.0,0.0,0.0
4181,Edna started to laugh and could not stop.,0.6692,0.3,0.1
4182,"“Take me away from here,” she said, “you bankrupts.” “What kind of a row was it?” I asked Edna.",0.0,0.6,0.9
4183,We were walking across the square to the Suizo.,0.0,0.0,0.0
4184,Bill was gone.,0.0,0.0,0.0
4185,"“I don’t know what happened, but some one had the police called to keep Mike out of the back room.",0.0,0.0,0.0
4186,There were some people that had known Mike at Cannes.,0.0,0.0,0.0
4187,What’s the matter with Mike?” “Probably he owes them money” I said.,0.0258,0.0,0.0
4188,“That’s what people usually get bitter about.” In front of the ticket-booths out in the square there were two lines of people waiting.,-0.4215,-0.175,0.375
4189,They were sitting on chairs or crouched on the ground with blankets and newspapers around them.,0.0,0.0,0.0
4190,They were waiting for the wickets to open in the morning to buy tickets for the bull-fight.,0.0,0.0,0.5
4191,The night was clearing and the moon was out.,0.0,0.0,0.0
4192,Some of the people in the line were sleeping.,0.0,0.0,0.0
4193,At the Café Suizo we had just sat down and ordered Fundador when Robert Cohn came up.,0.0,-0.15555555555555559,0.2888888888888889
4194,“Where’s Brett?” he asked.,0.0,0.0,0.0
4195,“I don’t know.” “She was with you.” “She must have gone to bed.” “She’s not.” “I don’t know where she is.” His face was sallow under the light.,0.0,0.4,0.7
4196,He was standing up.,0.0,0.0,0.0
4197,"“Tell me where she is.” “Sit down,” I said.",0.0,-0.15555555555555559,0.2888888888888889
4198,"“I don’t know where she is.” “The hell you don’t!” “You can shut your face.” “Tell me where Brett is.” “I’ll not tell you a damn thing.” “You know where she is.” “If I did I wouldn’t tell you.” “Oh, go to hell, Cohn,” Mike called from the table.",-0.8494,0.0,0.0
4199,“Brett’s gone off with the bull-fighter chap.,0.0,0.0,0.0
4200,"They’re on their honeymoon.” “You shut up.” “Oh, go to hell!” Mike said languidly.",0.0,0.0,0.0
4201,“Is that where she is?” Cohn turned to me.,0.0,0.0,0.0
4202,“Go to hell!” “She was with you.,0.0,0.0,0.0
4203,Is that where she is?” “Go to hell!” “I’ll make you tell me”—he stepped forward—“you damned pimp.” I swung at him and he ducked.,-0.4389,0.0,0.0
4204,I saw his face duck sideways in the light.,0.0,0.4,0.7
4205,He hit me and I sat down on the pavement.,0.0,-0.15555555555555559,0.2888888888888889
4206,As I started to get on my feet he hit me twice.,0.0,0.0,0.0
4207,I went down backward under a table.,0.0,-0.15555555555555559,0.2888888888888889
4208,I tried to get up and felt I did not have any legs.,0.0,0.0,0.0
4209,I felt I must get on my feet and try and hit him.,0.0,0.0,0.0
4210,Mike helped me up.,0.0,0.0,0.0
4211,Some one poured a carafe of water on my head.,0.0,0.0,0.0
4212,"Mike had an arm around me, and I found I was sitting on a chair.",0.0,0.0,0.0
4213,Mike was pulling at my ears.,0.0,0.0,0.0
4214,"“I say, you were cold,” Mike said.",0.0,-0.6,1.0
4215,"“Where the hell were you?” “Oh, I was around.” “You didn’t want to mix in it?” “He knocked Mike down, too,” Edna said.",-0.6868,-0.15555555555555559,0.2888888888888889
4216,"“He didn’t knock me out,” Mike said.",0.0,0.0,0.0
4217,“I just lay there.” “Does this happen every night at your fiestas?” Edna asked.,0.0,0.0,0.0
4218,"“Wasn’t that Mr. Cohn?” “I’m all right,” I said.",0.0,0.2857142857142857,0.5357142857142857
4219,“My head’s a little wobbly.” There were several waiters and a crowd of people standing around.,0.0,-0.09375,0.25
4220,“Vaya!” said Mike.,0.0,0.0,0.0
4221,“Get away.,0.0,0.0,0.0
4222,Go on.” The waiters moved the people away.,0.0,0.0,0.0
4223,"“It was quite a thing to watch,” Edna said.",0.0,0.0,0.0
4224,"“He must be a boxer.” “He is.” “I wish Bill had been here,” Edna said.",0.4019,0.0,0.0
4225,"“I’d like to have seen Bill knocked down, too.",0.3612,-0.15555555555555559,0.2888888888888889
4226,I’ve always wanted to see Bill knocked down.,0.0,-0.15555555555555559,0.2888888888888889
4227,"He’s so big.” “I was hoping he would knock down a waiter,” Mike said, “and get arrested.",-0.0772,-0.07777777777777779,0.19444444444444448
4228,"I’d like to see Mr. Robert Cohn in jail.” “No,” I said.",0.3612,-0.1,0.0
4229,"“Oh, no,” said Edna.",0.0,0.0,0.0
4230,"“You don’t mean that.” “I do, though,” Mike said.",0.0,-0.3125,0.6875
4231,“I’m not one of these chaps likes being knocked about.,0.4215,0.0,0.0
4232,"I never play games, even.” Mike took a drink.",-0.2584,0.0,0.0
4233,"“I never liked to hunt, you know.",-0.3252,-0.3,0.8
4234,There was always the danger of having a horse fall on you.,-0.5267,0.0,0.0
4235,"How do you feel, Jake?” “All right.” “You’re nice,” Edna said to Mike.",0.0,0.44285714285714284,0.7678571428571428
4236,"“Are you really a bankrupt?” “I’m a tremendous bankrupt,” Mike said.",0.0,0.26666666666666666,0.6
4237,“I owe money to everybody.,0.0,0.0,0.0
4238,"Don’t you owe any money?” “Tons.” “I owe everybody money,” Mike said.",0.0,0.0,0.0
4239,"“I borrowed a hundred pesetas from Montoya to-night.” “The hell you did,” I said.",-0.6808,0.0,0.0
4240,"“I’ll pay it back,” Mike said.",-0.1027,0.0,0.0
4241,"“I always pay everything back.” “That’s why you’re a bankrupt, isn’t it?” Edna said.",-0.6124,0.0,0.0
4242,I stood up.,0.0,0.0,0.0
4243,I had heard them talking from a long way away.,0.0,-0.05,0.4
4244,It all seemed like some bad play.,0.1027,-0.6999999999999998,0.6666666666666666
4245,"“I’m going over to the hotel,” I said.",0.0,0.0,0.0
4246,Then I heard them talking about me.,0.0,0.0,0.0
4247,“Is he all right?” Edna asked.,0.0,0.2857142857142857,0.5357142857142857
4248,"“We’d better walk with him.” “I’m all right,” I said.",0.4404,0.39285714285714285,0.5178571428571428
4249,“Don’t come.,0.0,0.0,0.0
4250,I’ll see you all later.” I walked away from the café.,0.0,0.0,0.0
4251,They were sitting at the table.,0.0,0.0,0.0
4252,I looked back at them and at the empty tables.,-0.2023,-0.05,0.25
4253,There was a waiter sitting at one of the tables with his head in his hands.,0.0,0.0,0.0
4254,Walking across the square to the hotel everything looked new and changed.,0.0,0.13636363636363635,0.45454545454545453
4255,I had never seen the trees before.,0.0,0.0,0.0
4256,"I had never seen the flagpoles before, nor the front of the theatre.",0.0,0.0,0.0
4257,It was all different.,0.0,0.0,0.6
4258,I felt as I felt once coming home from an out-of-town football game.,0.0,-0.4,0.4
4259,"I was carrying a suitcase with my football things in it, and I walked up the street from the station in the town I had lived in all my life and it was all new.",0.0,0.13636363636363635,0.45454545454545453
4260,"They were raking the lawns and burning leaves in the road, and I stopped for a long time and watched.",-0.2263,-0.05,0.4
4261,It was all strange.,-0.2023,-0.05,0.15
4262,"Then I went on, and my feet seemed to be a long way off, and everything seemed to come from a long way off, and I could hear my feet walking a great distance away.",0.6249,0.23333333333333336,0.5166666666666667
4263,I had been kicked in the head early in the game.,0.0,-0.15000000000000002,0.35
4264,It was like that crossing the square.,0.3612,0.0,0.0
4265,It was like that going up the stairs in the hotel.,0.3612,0.0,0.0
4266,"Going up the stairs took a long time, and I had the feeling that I was carrying my suitcase.",0.128,-0.05,0.4
4267,There was a light in the room.,0.0,0.4,0.7
4268,Bill came out and met me in the hall.,0.0,0.0,0.0
4269,"“Say,” he said, “go up and see Cohn.",0.0,0.0,0.0
4270,"He’s been in a jam, and he’s asking for you.” “The hell with him.” “Go on.",-0.6808,0.0,0.0
4271,Go on up and see him.” I did not want to climb another flight of stairs.,-0.0572,0.0,0.0
4272,“What are you looking at me that way for?” “I’m not looking at you.,0.0,0.0,0.0
4273,Go on up and see Cohn.,0.0,0.0,0.0
4274,"He’s in bad shape.” “You were drunk a little while ago,” I said.",-0.7096,-0.4624999999999999,0.7222222222222222
4275,"“I’m drunk now,” Bill said.",-0.34,-0.5,1.0
4276,“But you go up and see Cohn.,0.0,0.0,0.0
4277,"He wants to see you.” “All right,” I said.",0.0,0.24285714285714285,0.31785714285714284
4278,It was just a matter of climbing more stairs.,0.0258,0.5,0.5
4279,I went on up the stairs carrying my phantom suitcase.,0.0,0.0,0.0
4280,I walked down the hall to Cohn’s room.,0.0,-0.15555555555555559,0.2888888888888889
4281,The door was shut and I knocked.,0.0,0.0,0.0
4282,"“Who is it?” “Barnes.” “Come in, Jake.” I opened the door and went in, and set down my suitcase.",0.0,-0.15555555555555559,0.2888888888888889
4283,There was no light in the room.,-0.296,-0.2,0.7
4284,"Cohn was lying, face down, on the bed in the dark.",-0.5267,-0.1527777777777778,0.34444444444444444
4285,"“Hello, Jake.” “Don’t call me Jake.” I stood by the door.",0.0,0.0,0.0
4286,It was just like this that I had come home.,0.3612,0.0,0.0
4287,Now it was a hot bath that I needed.,0.0,0.25,0.8500000000000001
4288,"A deep, hot bath, to lie back in.",0.0,0.08333333333333333,0.4166666666666667
4289,“Where’s the bathroom?” I asked.,0.0,0.0,0.0
4290,Cohn was crying.,-0.4767,-0.2,0.6
4291,"There he was, face down on the bed, crying.",-0.4767,-0.1777777777777778,0.4444444444444444
4292,"He had on a white polo shirt, the kind he’d worn at Princeton.",0.296,0.3,0.45
4293,"“I’m sorry, Jake.",-0.0772,-0.5,1.0
4294,"Please forgive me.” “Forgive you, hell.” “Please forgive me, Jake.” I did not say anything.",0.6705,0.0,0.0
4295,I stood there by the door.,0.0,0.0,0.0
4296,“I was crazy.,-0.34,-0.6,0.9
4297,"You must see how it was.” “Oh, that’s all right.” “I couldn’t stand it about Brett.” “You called me a pimp.” I did not care.",-0.3875,0.2857142857142857,0.5357142857142857
4298,I wanted a hot bath.,0.0,0.25,0.8500000000000001
4299,I wanted a hot bath in deep water.,0.0,0.125,0.625
4300,“I know.,0.0,0.0,0.0
4301,Please don’t remember it.,0.3182,0.0,0.0
4302,I was crazy.” “That’s all right.” He was crying.,-0.4767,-0.1714285714285714,0.6785714285714285
4303,His voice was funny.,0.4404,0.25,1.0
4304,He lay there in his white shirt on the bed in the dark.,0.0,-0.075,0.2
4305,His polo shirt.,0.0,0.0,0.0
4306,“I’m going away in the morning.” He was crying without making any noise.,-0.4767,-0.2,0.6
4307,“I just couldn’t stand it about Brett.,0.0,0.0,0.0
4308,"I’ve been through hell, Jake.",-0.6808,0.0,0.0
4309,It’s been simply hell.,-0.6808,0.0,0.35714285714285715
4310,When I met her down here Brett treated me as though I were a perfect stranger.,0.5719,0.4222222222222222,0.6444444444444445
4311,I just couldn’t stand it.,0.0,0.0,0.0
4312,We lived together at San Sebastian.,0.0,0.0,0.0
4313,I suppose you know it.,0.0,0.0,0.0
4314,I can’t stand it any more.” He lay there on the bed.,0.0,0.5,0.5
4315,"“Well,” I said, “I’m going to take a bath.” “You were the only friend I had, and I loved Brett so.” “Well,” I said, “so long.” “I guess it isn’t any use,” he said.",0.7964,0.21666666666666665,0.7333333333333334
4316,“I guess it isn’t any damn use.” “What?” “Everything.,-0.4019,0.0,0.0
4317,"Please say you forgive me, Jake.” “Sure,” I said.",0.5267,0.5,0.8888888888888888
4318,“It’s all right.” “I felt so terribly.,-0.6825,-0.35714285714285715,0.7678571428571428
4319,"I’ve been through such hell, Jake.",-0.6808,0.0,0.5
4320,Now everything’s gone.,0.0,0.0,0.0
4321,"Everything.” “Well,” I said, “so long.",0.0,-0.05,0.4
4322,"I’ve got to go.” He rolled over, sat on the edge of the bed, and then stood up.",0.0,0.0,0.0
4323,"“So long, Jake,” he said.",0.0,-0.05,0.4
4324,"“You’ll shake hands, won’t you?” “Sure.",-0.1779,0.5,0.8888888888888888
4325,Why not?” We shook hands.,-0.1027,0.0,0.0
4326,In the dark I could not see his face very well.,0.3384,0.02500000000000001,0.35
4327,"“Well,” I said, “see you in the morning.” “I’m going away in the morning.” “Oh, yes,” I said.",0.0,0.0,0.0
4328,I went out.,0.0,0.0,0.0
4329,Cohn was standing in the door of the room.,0.0,0.0,0.0
4330,"“Are you all right, Jake?” he asked.",0.0,0.2857142857142857,0.5357142857142857
4331,"“Oh, yes,” I said.",0.0,0.0,0.0
4332,“I’m all right.” I could not find the bathroom.,0.0,0.2857142857142857,0.5357142857142857
4333,After a while I found it.,0.0,0.0,0.0
4334,There was a deep stone tub.,0.0,0.0,0.4
4335,I turned on the taps and the water would not run.,0.0,0.0,0.0
4336,I sat down on the edge of the bath-tub.,0.0,-0.15555555555555559,0.2888888888888889
4337,When I got up to go I found I had taken off my shoes.,0.0,0.0,0.0
4338,I hunted for them and found them and carried them down-stairs.,0.0,0.0,0.0
4339,I found my room and went inside and undressed and got into bed.,0.0,0.0,0.0
4340,*        *        *        *        * I woke with a headache and the noise of the bands going by in the street.,0.0,0.0,0.0
4341,I remembered I had promised to take Bill’s friend Edna to see the bulls go through the street and into the ring.,0.6908,0.0,0.0
4342,I dressed and went down-stairs and out into the cold early morning.,0.0,-0.25,0.65
4343,"People were crossing the square, hurrying toward the bull-ring.",0.0,0.0,0.0
4344,Across the square were the two lines of men in front of the ticket-booths.,0.0,0.0,0.0
4345,They were still waiting for the tickets to go on sale at seven o’clock.,0.0,0.0,0.0
4346,I hurried across the street to the café.,0.0,0.0,0.0
4347,The waiter told me that my friends had been there and gone.,0.4767,0.0,0.0
4348,“How many were they?” “Two gentlemen and a lady.” That was all right.,0.0,0.39285714285714285,0.5178571428571428
4349,Bill and Mike were with Edna.,0.0,0.0,0.0
4350,She had been afraid last night they would pass out.,0.0,-0.3,0.48333333333333334
4351,That was why I was to be sure to take her.,0.3182,0.5,0.8888888888888888
4352,I drank the coffee and hurried with the other people toward the bull-ring.,0.0,-0.125,0.375
4353,I was not groggy now.,0.0,0.0,0.0
4354,There was only a bad headache.,-0.5423,-0.3499999999999999,0.8333333333333333
4355,"Everything looked sharp and clear, and the town smelt of the early morning.",0.3818,0.02500000000000001,0.4777777777777778
4356,The stretch of ground from the edge of the town to the bull-ring was muddy.,0.0,0.0,0.0
4357,"There was a crowd all along the fence that led to the ring, and the outside balconies and the top of the bull-ring were solid with people.",0.34,0.16666666666666666,0.21666666666666667
4358,"I heard the rocket and I knew I could not get into the ring in time to see the bulls come in, so I shoved through the crowd to the fence.",0.0,0.0,0.0
4359,I was pushed close against the planks of the fence.,0.0,0.0,0.0
4360,Between the two fences of the runway the police were clearing the crowd along.,0.0,0.0,0.0
4361,They walked or trotted on into the bull-ring.,0.0,0.0,0.0
4362,Then people commenced to come running.,0.0,0.0,0.0
4363,A drunk slipped and fell.,-0.34,-0.5,1.0
4364,Two policemen grabbed him and rushed him over to the fence.,0.0,0.0,0.0
4365,The crowd were running fast now.,0.0,0.2,0.6
4366,"There was a great shout from the crowd, and putting my head through between the boards I saw the bulls just coming out of the street into the long running pen.",0.6249,0.375,0.575
4367,They were going fast and gaining on the crowd.,0.4215,0.2,0.6
4368,Just then another drunk started out from the fence with a blouse in his hands.,-0.34,-0.5,1.0
4369,He wanted to do capework with the bulls.,0.0,0.0,0.0
4370,"The two policemen tore out, collared him, one hit him with a club, and they dragged him against the fence and stood flattened out against the fence as the last of the crowd and the bulls went by.",-0.0516,0.0,0.06666666666666667
4371,"There were so many people running ahead of the bulls that the mass thickened and slowed up going through the gate into the ring, and as the bulls passed, galloping together, heavy, muddy-sided, horns swinging, one shot ahead, caught a man in the running crowd in the back and lifted him in the air.",0.0,0.09999999999999999,0.3333333333333333
4372,"Both the man’s arms were by his sides, his head went back as the horn went in, and the bull lifted him and then dropped him.",0.0,0.0,0.0
4373,"The bull picked another man running in front, but the man disappeared into the crowd, and the crowd was through the gate and into the ring with the bulls behind them.",-0.3291,-0.4,0.7
4374,"The red door of the ring went shut, the crowd on the outside balconies of the bull-ring were pressing through to the inside, there was a shout, then another shout.",0.0,0.0,0.025
4375,The man who had been gored lay face down in the trampled mud.,0.0,-0.15555555555555559,0.2888888888888889
4376,"People climbed over the fence, and I could not see the man because the crowd was so thick around him.",0.0,-0.30000000000000004,0.475
4377,From inside the ring came the shouts.,0.0,0.0,0.0
4378,Each shout meant a charge by some bull into the crowd.,0.0,0.0,0.0
4379,You could tell by the degree of intensity in the shout how bad a thing it was that was happening.,-0.5423,-0.6999999999999998,0.6666666666666666
4380,Then the rocket went up that meant the steers had gotten the bulls out of the ring and into the corrals.,0.0,0.0,0.0
4381,I left the fence and started back toward the town.,0.0,0.0,0.0
4382,Back in the town I went to the café to have a second coffee and some buttered toast.,0.0,0.0,0.0
4383,The waiters were sweeping out the café and mopping off the tables.,0.0,0.0,0.0
4384,One came over and took my order.,0.0,0.0,0.0
4385,“Anything happen at the encierro?” “I didn’t see it all.,0.0,0.0,0.0
4386,"One man was badly cogido.” “Where?” “Here.” I put one hand on the small of my back and the other on my chest, where it looked as though the horn must have come through.",0.0258,-0.26874999999999993,0.36041666666666666
4387,The waiter nodded his head and swept the crumbs from the table with his cloth.,0.0,0.0,0.0
4388,"“Badly cogido,” he said.",0.0,-0.6999999999999998,0.6666666666666666
4389,“All for sport.,0.0,0.0,0.0
4390,All for pleasure.” He went away and came back with the long-handled coffee and milk pots.,0.0,0.0,0.0
4391,He poured the milk and coffee.,0.0,0.0,0.0
4392,It came out of the long spouts in two streams into the big cup.,0.0,-0.025,0.25
4393,The waiter nodded his head.,0.0,0.0,0.0
4394,"“Badly cogido through the back,” he said.",0.0,-0.3499999999999999,0.3333333333333333
4395,He put the pots down on the table and sat down in the chair at the table.,0.0,-0.15555555555555559,0.2888888888888889
4396,“A big horn wound.,0.0,0.0,0.1
4397,All for fun.,0.5106,0.3,0.2
4398,Just for fun.,0.5106,0.3,0.2
4399,What do you think of that?” “I don’t know.” “That’s it.,0.0,0.0,0.0
4400,All for fun.,0.5106,0.3,0.2
4401,"Fun, you understand.” “You’re not an aficionado?” “Me?",0.5661,0.3,0.2
4402,What are bulls?,0.0,0.0,0.0
4403,Animals.,0.0,0.0,0.0
4404,Brute animals.” He stood up and put his hand on the small of his back.,0.4939,-0.125,0.2
4405,“Right through the back.,0.0,0.14285714285714285,0.26785714285714285
4406,A cornada right through the back.,0.0,0.14285714285714285,0.26785714285714285
4407,"For fun—you understand.” He shook his head and walked away, carrying the coffee-pots.",-0.1027,0.0,0.0
4408,Two men were going by in the street.,0.0,0.0,0.0
4409,The waiter shouted to them.,0.0,0.0,0.0
4410,They were grave-looking.,0.0,0.0,0.0
4411,One shook his head.,-0.1027,0.0,0.0
4412,“Muerto!” he called.,0.0,0.0,0.0
4413,The waiter nodded his head.,0.0,0.0,0.0
4414,The two men went on.,0.0,0.0,0.0
4415,They were on some errand.,0.0,0.0,0.0
4416,The waiter came over to my table.,0.0,0.0,0.0
4417,“You hear?,0.0,0.0,0.0
4418,Muerto.,0.0,0.0,0.0
4419,Dead.,-0.6486,-0.2,0.4
4420,He’s dead.,-0.6486,-0.2,0.4
4421,With a horn through him.,0.0,0.0,0.0
4422,All for morning fun.,0.5106,0.3,0.2
4423,"Es muy flamenco.” “It’s bad.” “Not for me,” the waiter said.",0.0,-0.6999999999999998,0.6666666666666666
4424,"“No fun in that for me.” Later in the day we learned that the man who was killed was named Vicente Girones, and came from near Tafalla.",-0.296,-0.06249999999999999,0.15000000000000002
4425,"The next day in the paper we read that he was twenty-eight years old, and had a farm, a wife, and two children.",0.0,0.05,0.1
4426,He had continued to come to the fiesta each year after he was married.,0.4767,0.25,0.25
4427,"The next day his wife came in from Tafalla to be with the body, and the day after there was a service in the chapel of San Fermin, and the coffin was carried to the railway-station by members of the dancing and drinking society of Tafalla.",0.0,0.0,0.0
4428,"The drums marched ahead, and there was music on the fifes, and behind the men who carried the coffin walked the wife and two children.",0.0,-0.4,0.7
4429,.,0.0,0.0,0.0
4430,.,0.0,0.0,0.0
4431,.,0.0,0.0,0.0
4432,"Behind them marched all the members of the dancing and drinking societies of Pamplona, Estella, Tafalla, and Sanguesa who could stay over for the funeral.",-0.3612,-0.4,0.7
4433,"The coffin was loaded into the baggage-car of the train, and the widow and the two children rode, sitting, all three together, in an open third-class railway-carriage.",0.0,0.0,0.5
4434,"The train started with a jerk, and then ran smoothly, going down grade around the edge of the plateau and out into the fields of grain that blew in the wind on the plain on the way to Tafalla.",-0.34,0.010052910052910055,0.3820105820105821
4435,"The bull who killed Vicente Girones was named Bocanegra, was Number 118 of the bull-breeding establishment of Sanchez Tabemo, and was killed by Pedro Romero as the third bull of that same afternoon.",-0.8658,-0.1,0.03125
4436,"His ear was cut by popular acclamation and given to Pedro Romero, who, in turn, gave it to Brett, who wrapped it in a handkerchief belonging to myself, and left both ear and handkerchief, along with a number of Muratti cigarette-stubs, shoved far back in the drawer of the bed-table that stood beside her bed in the Hotel Montoya, in Pamplona.",0.25,0.175,0.475
4437,"*        *        *        *        * Back in the hotel, the night watchman was sitting on a bench inside the door.",0.0,0.0,0.0
4438,He had been there all night and was very sleepy.,0.0,0.2,0.3
4439,He stood up as I came in.,0.0,0.0,0.0
4440,Three of the waitresses came in at the same time.,0.0,0.0,0.125
4441,They had been to the morning show at the bull-ring.,0.0,0.0,0.0
4442,They went up-stairs laughing.,0.4939,0.0,0.0
4443,I followed them up-stairs and went into my room.,0.0,0.0,0.0
4444,I took off my shoes and lay down on the bed.,0.0,-0.15555555555555559,0.2888888888888889
4445,The window was open onto the balcony and the sunlight was bright in the room.,0.4404,0.35000000000000003,0.6499999999999999
4446,I did not feel sleepy.,0.0,0.0,0.0
4447,It must have been half past three o’clock when I had gone to bed and the bands had waked me at six.,0.0,-0.20833333333333331,0.20833333333333331
4448,My jaw was sore on both sides.,-0.3612,0.0,0.0
4449,I felt it with my thumb and fingers.,0.0,0.0,0.0
4450,That damn Cohn.,-0.4019,0.0,0.0
4451,"He should have hit somebody the first time he was insulted, and then gone away.",-0.5106,0.25,0.3333333333333333
