,Sentence,sentiment,Sentiment Score,Subjectivity
2735,We had lunch at the inn and Harris went with us to the bus.,0.0,0.0,0.0
2736,"He gave us his card, with his address in London and his club and his business address, and as we got on the bus he handed us each an envelope.",0.0,0.0,0.0
2737,I opened mine and there were a dozen flies in it.,0.0,0.0,0.0
2738,Harris had tied them himself.,0.0,0.0,0.0
2739,He tied all his own flies.,0.0,0.6,1.0
2740,"“I say, Harris—” I began.",0.0,0.0,0.0
2741,"“No, no!” he said.",0.0,0.0,0.0
2742,He was climbing down from the bus.,0.0,-0.15555555555555559,0.2888888888888889
2743,“They’re not first-rate flies at all.,0.0,0.0,0.0
2744,I only thought if you fished them some time it might remind you of what a good time we had.” The bus started.,0.4404,0.35,0.8
2745,Harris stood in front of the post-office.,0.0,0.0,0.0
2746,He waved.,0.0,0.0,0.0
2747,As we started along the road he turned and walked back toward the inn.,0.0,0.0,0.0
2748,"“Say, wasn’t that Harris nice?” Bill said.",0.0,0.6,1.0
2749,“I think he really did have a good time.” “Harris?,0.4877,0.44999999999999996,0.4
2750,You bet he did.” “I wish he’d come into Pamplona.” “He wanted to fish.” “Yes.,0.4019,0.0,0.0
2751,"You couldn’t tell how English would mix with each other, anyway.” “I suppose not.” We got into Pamplona late in the afternoon and the bus stopped in front of the Hotel Montoya.",-0.2263,-0.14166666666666666,0.325
2752,Out in the plaza they were stringing electric-light wires to light the plaza for the fiesta.,0.4767,0.4,0.7
2753,"A few kids came up when the bus stopped, and a customs officer for the town made all the people getting down from the bus open their bundles on the sidewalk.",-0.2263,-0.11851851851851854,0.29629629629629634
2754,We went into the hotel and on the stairs I met Montoya.,0.0,0.0,0.0
2755,"He shook hands with us, smiling in his embarrassed way.",0.0258,0.0,0.0
2756,"“Your friends are here,” he said.",0.4767,0.0,0.0
2757,“Mr.,0.0,0.0,0.0
2758,Campbell?” “Yes.,0.0,0.0,0.0
2759,Mr. Cohn and Mr. Campbell and Lady Ashley.” He smiled as though there were something I would hear about.,0.5423,0.6,0.2
2760,“When did they get in?” “Yesterday.,0.0,0.0,0.0
2761,I’ve saved you the rooms you had.” “That’s fine.,0.5574,0.4166666666666667,0.5
2762,Did you give Mr. Campbell the room on the plaza?” “Yes.,0.0,0.0,0.0
2763,All the rooms we looked at.” “Where are our friends now?” “I think they went to the pelota.” “And how about the bulls?” Montoya smiled.,0.7882,0.6,0.2
2764,"“To-night,” he said.",0.0,0.0,0.0
2765,"“To-night at seven o’clock they bring in the Villar bulls, and to-morrow come the Miuras.",0.0,0.0,0.0
2766,"Do you all go down?” “Oh, yes.",0.4019,-0.15555555555555559,0.2888888888888889
2767,They’ve never seen a desencajonada.” Montoya put his hand on my shoulder.,0.4939,0.0,0.0
2768,“I’ll see you there.” He smiled again.,0.5423,0.6,0.2
2769,He always smiled as though bull-fighting were a very special secret between the two of us; a rather shocking but really very deep secret that we knew about.,0.3392,-0.12261904761904763,0.6438095238095238
2770,"He always smiled as though there were something lewd about the secret to outsiders, but that it was something that we understood.",0.3071,0.09999999999999998,0.44999999999999996
2771,It would not do to expose it to people who would not understand.,0.1139,0.0,0.0
2772,"“Your friend, is he aficionado, too?” Montoya smiled at Bill.",0.7717,0.6,0.2
2773,“Yes.,0.0,0.0,0.0
2774,He came all the way from New York to see the San Fermines.” “Yes?” Montoya politely disbelieved.,0.0,0.13636363636363635,0.45454545454545453
2775,“But he’s not aficionado like you.” He put his hand on my shoulder again embarrassedly.,-0.0026,0.0,0.0
2776,"“Yes,” I said.",0.0,0.0,0.0
2777,“He’s a real aficionado.” “But he’s not aficionado like you are.” Aficion means passion.,0.224,0.2,0.30000000000000004
2778,An aficionado is one who is passionate about the bull-fights.,0.5267,-0.05,0.8500000000000001
2779,"All the good bull-fighters stayed at Montoya’s hotel; that is, those with aficion stayed there.",0.4404,0.7,0.6000000000000001
2780,"The commercial bull-fighters stayed once, perhaps, and then did not come back.",0.0,0.0,0.0
2781,The good ones came each year.,0.4404,0.7,0.6000000000000001
2782,In Montoya’s room were their photographs.,0.0,0.0,0.0
2783,The photographs were dedicated to Juanito Montoya or to his sister.,0.4588,0.0,0.0
2784,The photographs of bull-fighters Montoya had really believed in were framed.,0.0,0.2,0.2
2785,Photographs of bull-fighters who had been without aficion Montoya kept in a drawer of his desk.,0.0,0.0,0.0
2786,They often had the most flattering inscriptions.,0.3804,0.5,0.5
2787,But they did not mean anything.,0.0,0.15625,0.6875
2788,One day Montoya took them all out and dropped them in the waste-basket.,0.0,0.0,0.0
2789,He did not want them around.,-0.0572,0.0,0.0
2790,We often talked about bulls and bull-fighters.,0.0,0.0,0.0
2791,I had stopped at the Montoya for several years.,-0.2263,0.0,0.0
2792,We never talked for very long at a time.,0.0,-0.065,0.52
2793,It was simply the pleasure of discovering what we each felt.,0.5719,0.0,0.35714285714285715
2794,Men would come in from distant towns and before they left Pamplona stop and talk for a few minutes with Montoya about bulls.,-0.296,-0.10000000000000002,0.15
2795,These men were aficionados.,0.0,0.0,0.0
2796,Those who were aficionados could always get rooms even when the hotel was full.,0.0,0.35,0.55
2797,Montoya introduced me to some of them.,0.0,0.0,0.0
2798,"They were always very polite at first, and it amused them very much that I should be an American.",0.4215,0.1775,0.22333333333333333
2799,Somehow it was taken for granted that an American could not have aficion.,0.25,0.0,0.0
2800,"He might simulate it or confuse it with excitement, but he could not really have it.",0.1655,-0.1,0.2
2801,"When they saw that I had aficion, and there was no password, no set questions that could bring it out, rather it was a sort of oral spiritual examination with the questions always a little on the defensive and never apparent, there was this same embarrassed putting the hand on the shoulder, or a “Buen hombre.” But nearly always there was the actual touching.",-0.2339,0.05535714285714286,0.3011904761904762
2802,It seemed as though they wanted to touch you to make it certain.,0.2732,0.21428571428571427,0.5714285714285714
2803,Montoya could forgive anything of a bull-fighter who had aficion.,0.2732,0.0,0.0
2804,"He could forgive attacks of nerves, panic, bad unexplainable actions, all sorts of lapses.",-0.8402,-0.6999999999999998,0.6666666666666666
2805,For one who had aficion he could forgive anything.,0.2732,0.0,0.0
2806,At once he forgave me all my friends.,0.6705,0.0,0.0
2807,"Without his ever saying anything they were simply a little something shameful between us, like the spilling open of the horses in bull-fighting.",-0.1082,-0.09375,0.5
2808,"Bill had gone up-stairs as we came in, and I found him washing and changing in his room.",0.0,0.0,0.0
2809,"“Well,” he said, “talk a lot of Spanish?” “He was telling me about the bulls coming in to-night.” “Let’s find the gang and go down.” “All right.",0.0,0.04338624338624337,0.27486772486772487
2810,They’ll probably be at the café.” “Have you got tickets?” “Yes.,0.0,0.0,0.0
2811,"I got them for all the unloadings.” “What’s it like?” He was pulling his cheek before the glass, looking to see if there were unshaved patches under the line of the jaw.",0.0,0.0,0.0
2812,"“It’s pretty good,” I said.",0.4939,0.475,0.8
2813,"“They let the bulls out of the cages one at a time, and they have steers in the corral to receive them and keep them from fighting, and the bulls tear in at the steers and the steers run around like old maids trying to quiet them down.” “Do they ever gore the steers?” “Sure.",0.0,0.1111111111111111,0.42777777777777776
2814,Sometimes they go right after them and kill them.” “Can’t the steers do anything?” “No.,-0.6908,0.2857142857142857,0.5357142857142857
2815,"They’re trying to make friends.” “What do they have them in for?” “To quiet down the bulls and keep them from breaking horns against the stone walls, or goring each other.” “Must be swell being a steer.” We went down the stairs and out of the door and walked across the square toward the Café Iruña.",0.0,-0.10902777777777778,0.3215277777777778
2816,There were two lonely looking ticket-houses standing in the square.,-0.3612,-0.09999999999999998,0.7
2817,"Their windows, marked SOL, SOL Y SOMBRA, and SOMBRA, were shut.",0.0,0.1,0.6
2818,They would not open until the day before the fiesta.,0.4767,0.0,0.5
2819,Across the square the white wicker tables and chairs of the Iruña extended out beyond the Arcade to the edge of the street.,0.0,0.0,0.0
2820,I looked for Brett and Mike at the tables.,0.0,0.0,0.0
2821,There they were.,0.0,0.0,0.0
2822,Brett and Mike and Robert Cohn.,0.0,0.0,0.0
2823,Brett was wearing a Basque beret.,0.0,0.0,0.0
2824,So was Mike.,0.0,0.0,0.0
2825,Robert Cohn was bare-headed and wearing his spectacles.,0.0,0.0,0.0
2826,Brett saw us coming and waved.,0.0,0.0,0.0
2827,Her eyes crinkled up as we came up to the table.,0.0,0.0,0.0
2828,"“Hello, you chaps!” she called.",0.0,0.0,0.0
2829,Brett was happy.,0.5719,0.8,1.0
2830,Mike had a way of getting an intensity of feeling into shaking hands.,-0.0516,0.0,0.0
2831,Robert Cohn shook hands because we were back.,-0.1027,0.0,0.0
2832,“Where the hell have you been?” I asked.,-0.6808,0.0,0.0
2833,"“I brought them up here,” Cohn said.",0.0,0.0,0.0
2834,"“What rot,” Brett said.",0.0,0.0,0.0
2835,“We’d have gotten here earlier if you hadn’t come.” “You’d never have gotten here.” “What rot!,0.0,0.0,0.5
2836,You chaps are brown.,0.0,0.0,0.0
2837,Look at Bill.” “Did you get good fishing?” Mike asked.,0.4404,0.7,0.6000000000000001
2838,“We wanted to join you.” “It wasn’t bad.,-0.3182,-0.6999999999999998,0.6666666666666666
2839,"We missed you.” “I wanted to come,” Cohn said, “but I thought I ought to bring them.” “You bring us.",-0.296,0.0,0.0
2840,What rot.” “Was it really good?” Mike asked.,0.0,0.7,0.6000000000000001
2841,“Did you take many?” “Some days we took a dozen apiece.,0.0,0.5,0.5
2842,"There was an Englishman up there.” “Named Harris,” Bill said.",0.0,0.0,0.0
2843,"“Ever know him, Mike?",0.0,0.0,0.0
2844,"He was in the war, too.” “Fortunate fellow,” Mike said.",-0.5994,0.4,0.7
2845,“What times we had.,0.0,0.0,0.0
2846,"How I wish those dear days were back.” “Don’t be an ass.” “Were you in the war, Mike?” Cohn asked.",0.1027,0.0,0.0
2847,"“Was I not.” “He was a very distinguished soldier,” Brett said.",0.0,0.2,0.3
2848,“Tell them about the time your horse bolted down Piccadilly.” “I’ll not.,0.0,-0.15555555555555559,0.2888888888888889
2849,"I’ve told that four times.” “You never told me,” Robert Cohn said.",0.0,0.0,0.0
2850,“I’ll not tell that story.,0.0,0.0,0.0
2851,It reflects discredit on me.” “Tell them about your medals.” “I’ll not.,0.0,0.0,0.0
2852,That story reflects great discredit on me.” “What story’s that?” “Brett will tell you.,0.6249,0.8,0.75
2853,She tells all the stories that reflect discredit on me.” “Go on.,0.0,0.0,0.0
2854,"Tell it, Brett.” “Should I?” “I’ll tell it myself.” “What medals have you got, Mike?” “I haven’t got any medals.” “You must have some.” “I suppose I’ve the usual medals.",0.0,-0.25,0.25
2855,But I never sent in for them.,0.0,0.0,0.0
2856,"One time there was this wopping big dinner and the Prince of Wales was to be there, and the cards said medals will be worn.",-0.296,0.0,0.1
2857,"So naturally I had no medals, and I stopped at my tailor’s and he was impressed by the invitation, and I thought that’s a good piece of business, and I said to him: ‘You’ve got to fix me up with some medals.’ He said: ‘What medals, sir?’ And I said: ‘Oh, any medals.",0.3892,0.6,0.6666666666666666
2858,"Just give me a few medals.’ So he said: ‘What medals _have_ you, sir?’ And I said: ‘How should I know?’ Did he think I spent all my time reading the bloody gazette?",-0.533,-0.3666666666666667,0.3666666666666667
2859,‘Just give me a good lot.,0.4404,0.7,0.6000000000000001
2860,"Pick them out yourself.’ So he got me some medals, you know, miniature medals, and handed me the box, and I put it in my pocket and forgot it.",0.0,0.0,0.0
2861,"Well, I went to the dinner, and it was the night they’d shot Henry Wilson, so the Prince didn’t come and the King didn’t come, and no one wore any medals, and all these coves were busy taking off their medals, and I had mine in my pocket.” He stopped for us to laugh.",0.3818,0.2,0.2
2862,“Is that all?” “That’s all.,0.0,0.0,0.0
2863,"Perhaps I didn’t tell it right.” “You didn’t,” said Brett.",0.0,0.2857142857142857,0.5357142857142857
2864,“But no matter.” We were all laughing.,0.25,0.0,0.0
2865,"“Ah, yes,” said Mike.",0.0,0.0,0.0
2866,“I know now.,0.0,0.0,0.0
2867,"It was a damn dull dinner, and I couldn’t stick it, so I left.",-0.6597,-0.14583333333333334,0.25
2868,Later on in the evening I found the box in my pocket.,0.0,0.0,0.0
2869,What’s this?,0.0,0.0,0.0
2870,I said.,0.0,0.0,0.0
2871,Medals?,0.0,0.0,0.0
2872,Bloody military medals?,-0.4404,-0.45,0.5
2873,"So I cut them all off their backing—you know, they put them on a strip—and gave them all around.",-0.3384,0.0,0.0
2874,Gave one to each girl.,0.0,0.0,0.0
2875,Form of souvenir.,0.0,0.0,0.0
2876,They thought I was hell’s own shakes of a soldier.,0.0,0.6,1.0
2877,Give away medals in a night club.,0.0,0.0,0.0
2878,"Dashing fellow.” “Tell the rest,” Brett said.",0.0,0.0,0.0
2879,“Don’t you think that was funny?” Mike asked.,0.0,0.25,1.0
2880,We were all laughing.,0.4939,0.0,0.0
2881,“It was.,0.0,0.0,0.0
2882,I swear it was.,-0.0516,0.0,0.0
2883,"Any rate, my tailor wrote me and wanted the medals back.",0.0,0.0,0.0
2884,Sent a man around.,0.0,0.0,0.0
2885,Kept on writing for months.,0.0,0.0,0.0
2886,Seems some chap had left them to be cleaned.,0.0,0.0,0.0
2887,Frightfully military cove.,-0.4019,-0.1,0.1
2888,Set hell’s own store by them.” Mike paused.,0.0,0.6,1.0
2889,"“Rotten luck for the tailor,” he said.",0.4588,0.0,0.0
2890,"“You don’t mean it,” Bill said.",0.0,-0.3125,0.6875
2891,“I should think it would have been grand for the tailor.” “Frightfully good tailor.,0.7096,0.6,0.8
2892,"Never believe it to see me now,” Mike said.",0.0,0.0,0.0
2893,“I used to pay him a hundred pounds a year just to keep him quiet.,-0.1027,-0.05,0.5166666666666666
2894,So he wouldn’t send me any bills.,0.0,0.0,0.0
2895,Frightful blow to him when I went bankrupt.,-0.7845,0.0,0.0
2896,It was right after the medals.,0.0,0.2857142857142857,0.5357142857142857
2897,Gave his letters rather a bitter tone.” “How did you go bankrupt?” Bill asked.,-0.4215,-0.1,0.5
2898,"“Two ways,” Mike said.",0.0,0.0,0.0
2899,"“Gradually and then suddenly.” “What brought it on?” “Friends,” said Mike.",0.0,0.0,0.5
2900,“I had a lot of friends.,0.4767,0.0,0.0
2901,False friends.,0.4767,-0.4000000000000001,0.6
2902,"Then I had creditors, too.",0.0,0.0,0.0
2903,"Probably had more creditors than anybody in England.” “Tell them about in the court,” Brett said.",0.0,0.5,0.5
2904,"“I don’t remember,” Mike said.",0.0,0.0,0.0
2905,“I was just a little tight.” “Tight!” Brett exclaimed.,0.0,-0.19642857142857142,0.35714285714285715
2906,"“You were blind!” “Extraordinary thing,” Mike said.",0.0,-0.14583333333333334,0.8333333333333333
2907,“Met my former partner the other day.,0.0,-0.0625,0.1875
2908,"Offered to buy me a drink.” “Tell them about your learned counsel,” Brett said.",0.0,0.0,0.0
2909,"“I will not,” Mike said.",0.0,0.0,0.0
2910,"“My learned counsel was blind, too.",-0.4019,-0.5,0.6666666666666666
2911,I say this is a gloomy subject.,-0.1531,-0.16666666666666666,0.3333333333333333
2912,"Are we going down and see these bulls unloaded or not?” “Let’s go down.” We called the waiter, paid, and started to walk through the town.",0.0,-0.15555555555555559,0.2888888888888889
2913,"I started off walking with Brett, but Robert Cohn came up and joined her on the other side.",0.0,-0.125,0.375
2914,"The three of us walked along, past the Ayuntamiento with the banners hung from the balcony, down past the market and down past the steep street that led to the bridge across the Arga.",0.0,-0.21222222222222223,0.2655555555555556
2915,"There were many people walking to go and see the bulls, and carriages drove down the hill and across the bridge, the drivers, the horses, and the whips rising above the walking people in the street.",0.0,0.11481481481481481,0.29629629629629634
2916,Across the bridge we turned up a road to the corrals.,0.0,0.0,0.0
2917,We passed a wine-shop with a sign in the window: Good Wine 30 Centimes A Liter.,0.4404,0.7,0.6000000000000001
2918,"“That’s where we’ll go when funds get low,” Brett said.",0.0,0.0,0.3
2919,The woman standing in the door of the wine-shop looked at us as we passed.,0.0,0.0,0.0
2920,She called to some one in the house and three girls came to the window and stared.,0.0,0.0,0.0
2921,They were staring at Brett.,0.0,0.0,0.0
2922,At the gate of the corrals two men took tickets from the people that went in.,0.0,0.0,0.0
2923,We went in through the gate.,0.0,0.0,0.0
2924,"There were trees inside and a low, stone house.",-0.2732,0.0,0.3
2925,"At the far end was the stone wall of the corrals, with apertures in the stone that were like loopholes running all along the face of each corral.",0.3612,0.1,1.0
2926,"A ladder led up to the top of the wall, and people were climbing up the ladder and spreading down to stand on the walls that separated the two corrals.",0.2023,0.17222222222222222,0.3944444444444445
2927,"As we came up the ladder, walking across the grass under the trees, we passed the big, gray painted cages with the bulls in them.",0.0,0.0,0.1
2928,There was one bull in each travelling-box.,0.0,0.0,0.0
2929,"They had come by train from a bull-breeding ranch in Castile, and had been unloaded off flat-cars at the station and brought up here to be let out of their cages into the corrals.",0.0,0.0,0.0
2930,Each cage was stencilled with the name and the brand of the bull-breeder.,0.0,0.0,0.0
2931,We climbed up and found a place on the wall looking down into the corral.,0.0,-0.15555555555555559,0.2888888888888889
2932,"The stone walls were whitewashed, and there was straw on the ground and wooden feed-boxes and water-troughs set against the wall.",0.0,0.0,0.0
2933,"“Look up there,” I said.",0.0,0.0,0.0
2934,Beyond the river rose the plateau of the town.,0.0,0.6,0.95
2935,All along the old walls and ramparts people were standing.,0.0,0.1,0.2
2936,The three lines of fortifications made three black lines of people.,0.0,-0.16666666666666666,0.43333333333333335
2937,Above the walls there were heads in the windows of the houses.,0.0,0.0,0.1
2938,At the far end of the plateau boys had climbed into the trees.,0.0,0.1,1.0
2939,"“They must think something is going to happen,” Brett said.",0.0,0.0,0.0
2940,“They want to see the bulls.” Mike and Bill were on the other wall across the pit of the corral.,0.0772,-0.125,0.375
2941,They waved to us.,0.0,0.0,0.0
2942,"People who had come late were standing behind us, pressing against us when other people crowded them.",0.0,-0.27499999999999997,0.5583333333333332
2943,“Why don’t they start?” Robert Cohn asked.,0.0,0.0,0.0
2944,A single mule was hitched to one of the cages and dragged it up against the gate in the corral wall.,-0.0516,-0.07142857142857142,0.21428571428571427
2945,The men shoved and lifted it with crowbars into position against the gate.,0.0,0.0,0.0
2946,Men were standing on the wall ready to pull up the gate of the corral and then the gate of the cage.,0.3612,0.2,0.5
2947,"At the other end of the corral a gate opened and two steers came in, swaying their heads and trotting, their lean flanks swinging.",0.0,-0.125,0.375
2948,"They stood together at the far end, their heads toward the gate where the bull would enter.",0.0,0.1,1.0
2949,"“They don’t look happy,” Brett said.",0.0,0.8,1.0
2950,The men on top of the wall leaned back and pulled up the door of the corral.,0.2023,0.25,0.25
2951,Then they pulled up the door of the cage.,0.0,0.0,0.0
2952,I leaned way over the wall and tried to see into the cage.,0.0,0.0,0.0
2953,It was dark.,0.0,-0.15,0.4
2954,Some one rapped on the cage with an iron bar.,0.0,0.0,0.0
2955,Inside something seemed to explode.,0.0,0.0,0.0
2956,"The bull, striking into the wood from side to side with his horns, made a great noise.",0.6249,0.65,0.875
2957,"Then I saw a dark muzzle and the shadow of horns, and then, with a clattering on the wood in the hollow box, the bull charged and came out into the corral, skidding with his forefeet in the straw as he stopped, his head up, the great hump of muscle on his neck swollen tight, his body muscles quivering as he looked up at the crowd on the stone walls.",0.34,0.09285714285714286,0.37142857142857144
2958,"The two steers backed away against the wall, their heads sunken, their eyes watching the bull.",0.0258,0.0,0.0
2959,The bull saw them and charged.,-0.2023,0.0,0.0
2960,"A man shouted from behind one of the boxes and slapped his hat against the planks, and the bull, before he reached the steer, turned, gathered himself and charged where the man had been, trying to reach him behind the planks with a half-dozen quick, searching drives with the right horn.",-0.0772,-0.04523809523809526,0.6089285714285714
2961,"“My God, isn’t he beautiful?” Brett said.",0.2732,0.85,1.0
2962,We were looking right down on him.,0.0,0.06507936507936506,0.4123015873015873
2963,"“Look how he knows how to use his horns,” I said.",0.0,0.0,0.0
2964,“He’s got a left and a right just like a boxer.” “Not really?” “You watch.” “It goes too fast.” “Wait.,0.3612,0.09642857142857142,0.33392857142857146
2965,There’ll be another one in a minute.” They had backed up another cage into the entrance.,0.0258,0.0,0.0
2966,"In the far corner a man, from behind one of the plank shelters, attracted the bull, and while the bull was facing away the gate was pulled up and a second bull came out into the corral.",0.4215,-0.10000000000000002,0.5666666666666667
2967,"He charged straight for the steers and two men ran out from behind the planks and shouted, to turn him.",0.0258,-0.1,0.55
2968,He did not change his direction and the men shouted: “Hah!,0.0,0.0,0.0
2969,Hah!,0.0,0.0,0.0
2970,"Toro!” and waved their arms; the two steers turned sideways to take the shock, and the bull drove into one of the steers.",-0.4389,0.0,0.0
2971,"“Don’t look,” I said to Brett.",0.0,0.0,0.0
2972,"She was watching, fascinated.",0.4767,0.0,0.0
2973,"“Fine,” I said.",0.0,0.4166666666666667,0.5
2974,"“If it doesn’t buck you.” “I saw it,” she said.",0.0,0.0,0.0
2975,"“I saw him shift from his left to his right horn.” “Damn good!” The steer was down now, his neck stretched out, his head twisted, he lay the way he had fallen.",-0.4199,0.07585978835978831,0.4041005291005291
2976,"Suddenly the bull left off and made for the other steer which had been standing at the far end, his head swinging, watching it all.",0.0,-0.006249999999999999,0.46875
2977,"The steer ran awkwardly and the bull caught him, hooked him lightly in the flank, and then turned away and looked up at the crowd on the walls, his crest of muscle rising.",-0.3182,-0.09999999999999998,0.85
2978,The steer came up to him and made as though to nose at him and the bull hooked perfunctorily.,0.0,0.0,0.0
2979,The next time he nosed at the steer and then the two of them trotted over to the other bull.,0.0,-0.0625,0.1875
2980,"When the next bull came out, all three, the two bulls and the steer, stood together, their heads side by side, their horns against the newcomer.",0.0,0.0,0.0
2981,"In a few minutes the steer picked the new bull up, quieted him down, and made him one of the herd.",0.0,-0.07306397306397308,0.28114478114478114
2982,When the last two bulls had been unloaded the herd were all together.,0.0,0.0,0.06666666666666667
2983,The steer who had been gored had gotten to his feet and stood against the stone wall.,0.0,0.0,0.0
2984,"None of the bulls came near him, and he did not attempt to join the herd.",-0.2235,0.1,0.4
2985,"We climbed down from the wall with the crowd, and had a last look at the bulls through the loopholes in the wall of the corral.",0.0,-0.07777777777777779,0.17777777777777778
2986,"They were all quiet now, their heads down.",0.0,-0.07777777777777779,0.3111111111111111
2987,We got a carriage outside and rode up to the café.,0.0,0.0,0.05
2988,Mike and Bill came in half an hour later.,0.0,-0.08333333333333333,0.08333333333333333
2989,They had stopped on the way for several drinks.,-0.2263,0.0,0.0
2990,We were sitting in the café.,0.0,0.0,0.0
2991,"“That’s an extraordinary business,” Brett said.",0.0,0.3333333333333333,1.0
2992,“Will those last ones fight as well as the first?” Robert Cohn asked.,-0.128,0.125,0.19999999999999998
2993,"“They seemed to quiet down awfully fast.” “They all know each other,” I said.",0.0,-0.020138888888888894,0.3993055555555556
2994,"“They’re only dangerous when they’re alone, or only two or three of them together.” “What do you mean, dangerous?” Bill said.",-0.6249,-0.3025,0.8975
